{
  "$schema": "../../skill.schema.json",
  "schema_version": 1,
  "id": "scrollport-evidence-led-content-brief",
  "title": "Evidence-led Content Brief",
  "version": "1.0.0",
  "status": "verified",
  "customer_proven": false,
  "summary": "Validate a content topic with current search-demand signals and cited public sources, then package the evidence into a writer-ready brief.",
  "outcome": "A writer-ready brief with one primary topic, audience and intent, a supported angle, source-backed claims, outline, exclusions and measurable acceptance criteria.",
  "boundary": "The Skill does not write or publish the finished article, reproduce source text, invent statistics, present vendor claims as independent proof or expand research without approval.",
  "categories": ["content", "research", "seo"],
  "aliases": ["evidence-led-content-brief", "content-brief"],
  "license": "MIT",
  "instruction_path": "SKILL.md",
  "changelog_path": "CHANGELOG.md",
  "dependencies": {
    "scrollport_control_tools": ["apps", "discover", "inspect", "run", "wallet"],
    "catalog_tools": [
      {
        "tool_id": "dataforseo.keyword-overview",
        "required": true,
        "purpose": "Validate demand, difficulty, intent and SERP context for a bounded topic set."
      },
      {
        "tool_id": "exa.search",
        "required": true,
        "purpose": "Retrieve current public sources that substantiate the brief's claims and angle."
      }
    ],
    "connected_apps": []
  },
  "inputs": [
    "A seed topic or business question",
    "Audience, business objective and desired action",
    "Country, language, exclusions and any required first-party sources"
  ],
  "outputs": [
    "Primary topic and supporting-topic evidence",
    "Cited claim ledger with source roles and cautions",
    "Writer-ready brief with angle, outline, exclusions and acceptance criteria"
  ],
  "cost": {
    "currency": "USD",
    "model": "Inspected keyword-batch and web-search prices for one bounded validation and evidence pass.",
    "trial_safe_max_usd": "0.050000",
    "notes": "Trial-safe mode validates at most five topics and retrieves at most five public sources in one search call; the exact inspected plan must remain at or below the stated maximum."
  },
  "approvals": [
    "Approve the topic set, market, research query, requested result count, exact paid inputs and maximum total before the first metered run",
    "Approve any second search, broader market, larger topic batch or additional provider"
  ],
  "compatibility": [
    "Agent Skills compatible host",
    "One authorized Scrollport connection with apps, discover, inspect, run and wallet",
    "A local file or conversation state for citations and the final brief"
  ],
  "evidence": {
    "verified_at": "2026-08-27",
    "review_due_at": "2026-09-27",
    "summary_path": "evidence/2026-08-27-verification.md",
    "customer_proof_path": null
  }
}
