{
  "$schema": "../../skill.schema.json",
  "schema_version": 1,
  "id": "scrollport-qualified-accounts-weekly",
  "title": "Qualified Accounts Weekly",
  "version": "0.1.0",
  "status": "draft",
  "customer_proven": false,
  "summary": "Turn a narrow ideal-customer profile into a small weekly account shortlist with structured firmographic evidence and timely reasons to act.",
  "outcome": "A ranked, evidence-backed answer to which accounts should be contacted this week, including fit reasons, disqualifiers, timely signals and next research steps.",
  "boundary": "The candidate does not find or verify people, send outreach, write to a CRM, promise an exact result count or treat a broad discovery result as a qualified shortlist.",
  "categories": ["prospecting", "sales", "research"],
  "aliases": ["qualified-accounts-weekly", "accounts-to-contact"],
  "license": "MIT",
  "instruction_path": "DRAFT.md",
  "changelog_path": "CHANGELOG.md",
  "dependencies": {
    "scrollport_control_tools": ["apps", "discover", "inspect", "run", "wallet"],
    "catalog_tools": [
      {
        "tool_id": "hunter.discover",
        "required": true,
        "purpose": "Discover company candidates from a natural-language ideal-customer profile."
      },
      {
        "tool_id": "akta.company-enrichment",
        "required": true,
        "purpose": "Validate one shortlisted company's firmographic fit with structured evidence."
      },
      {
        "tool_id": "akta.company-news",
        "required": false,
        "purpose": "Add a bounded recent company signal when a timely reason to act is required."
      },
      {
        "tool_id": "exa.search",
        "required": false,
        "purpose": "Add labelled public context without replacing the structured company spine."
      }
    ],
    "connected_apps": []
  },
  "inputs": [
    "A narrow ideal-customer profile with geography, business type, size and exclusions",
    "The business problem Scrollport or the seller can solve",
    "A weekly shortlist size and definition of a timely reason to act"
  ],
  "outputs": [
    "Accepted and rejected company candidates with fit reasons",
    "Structured firmographic evidence for the shortlisted accounts",
    "Ranked weekly account list with uncertainty and next-step labels"
  ],
  "cost": {
    "currency": "USD",
    "model": "Inspected per-call company discovery, enrichment and optional signal-research prices.",
    "trial_safe_max_usd": "0.200000",
    "notes": "Draft rehearsal is limited to one discovery call and one company enrichment; publication requires a reliably bounded, relevant shortlist rather than one manually rescued result."
  },
  "approvals": [
    "Approve the exact ideal-customer query, exclusions, planned enrichment count and maximum before research",
    "Approve any additional enrichment, news or web-research call"
  ],
  "compatibility": [
    "Agent Skills compatible host",
    "One authorized Scrollport connection with the five public control tools",
    "A local file or conversation state for the shortlist"
  ],
  "evidence": {
    "verified_at": null,
    "review_due_at": null,
    "summary_path": "evidence/2026-08-27-withheld.md",
    "customer_proof_path": null
  }
}
